{
  "$schema": "https://json-schema.org/draft/2020-12/schema", "$id": "https://example.invalid/global-province-map/start-date-location-assignments.schema.json", "title": "M24 Location Assignments and Targeted Splits", "type": "object",
  "required": ["schema_version", "document_type", "artifact_version", "pass_id", "start_date", "fabric_revision", "aggregation_revision", "aggregation_profile", "geometry_revision", "expected_province_count", "fabric_sidecars", "assignments", "targeted_split_requests"],
  "properties": {"schema_version": {"enum": ["0.1.0", "0.2.0", "0.3.0", "0.4.0"]}, "document_type": {"const": "start_date_location_assignments"}, "artifact_version": {"type": "string", "minLength": 1}, "pass_id": {"type": "string", "minLength": 1}, "start_date": {"type": "string", "format": "date"}, "fabric_revision": {"type": "string", "minLength": 1}, "aggregation_revision": {"type": "string", "minLength": 1}, "aggregation_profile": {"type": "string", "minLength": 1}, "geometry_revision": {"type": "string", "minLength": 1}, "expected_province_count": {"type": "integer", "minimum": 1},
    "fabric_sidecars": {"type": "object", "required": ["fabric_manifest", "locations", "lineage", "province_membership"], "properties": {"fabric_manifest": {"$ref": "#/$defs/sidecar"}, "locations": {"$ref": "#/$defs/sidecar"}, "lineage": {"$ref": "#/$defs/sidecar"}, "province_membership": {"$ref": "#/$defs/sidecar"}}, "additionalProperties": false},
    "constraint_sha256": {"type": "string", "pattern": "^[0-9a-fA-F]{64}$"},
    "release_sidecars": {"type": "object", "required": ["aggregation_manifest", "adjacency"], "properties": {"aggregation_manifest": {"$ref": "#/$defs/sidecar"}, "adjacency": {"$ref": "#/$defs/sidecar"}}, "additionalProperties": false},
    "assignments": {"type": "array", "minItems": 1, "items": {"type": "object", "required": ["assignment_id", "location_ids", "province_id", "polity_ids", "uncertainty", "source_ids", "notes"], "properties": {"assignment_id": {"type": "string", "minLength": 1}, "location_ids": {"$ref": "#/$defs/nonemptyStrings"}, "province_id": {"type": "string", "minLength": 1}, "polity_ids": {"$ref": "#/$defs/strings"}, "uncertainty": {"type": "number", "minimum": 0, "maximum": 1}, "source_ids": {"$ref": "#/$defs/nonemptyStrings"}, "notes": {"type": "string"},
      "region_id": {"type": "string", "minLength": 1}, "sovereign_polity_id": {"type": ["string", "null"], "minLength": 1}, "owner_polity_id": {"type": ["string", "null"], "minLength": 1}, "controller_polity_id": {"type": ["string", "null"], "minLength": 1}, "facets": {"$ref": "#/$defs/facets"},
      "core_polity_ids": {"$ref": "#/$defs/strings"}, "claim_polity_ids": {"$ref": "#/$defs/strings"}, "dispute_polity_ids": {"$ref": "#/$defs/strings"}, "hierarchy": {"$ref": "#/$defs/hierarchy"}, "status_relationships": {"type": "array", "items": {"$ref": "#/$defs/statusRelationship"}}
    }, "additionalProperties": false}},
    "targeted_split_requests": {"type": "array", "items": {"type": "object", "required": ["request_id", "location_ids", "reason", "status", "source_ids"], "properties": {"request_id": {"type": "string", "minLength": 1}, "location_ids": {"$ref": "#/$defs/nonemptyStrings"}, "reason": {"type": "string", "minLength": 1}, "status": {"enum": ["requested", "accepted", "rejected", "superseded"]}, "source_ids": {"$ref": "#/$defs/nonemptyStrings"}}, "additionalProperties": false}}
  }, "$defs": {
    "strings": {"type": "array", "uniqueItems": true, "items": {"type": "string", "minLength": 1}},
    "nonemptyStrings": {"type": "array", "minItems": 1, "uniqueItems": true, "items": {"type": "string", "minLength": 1}},
    "sidecar": {"type": "object", "required": ["path", "sha256"], "properties": {"path": {"type": "string", "minLength": 1}, "sha256": {"type": "string", "pattern": "^[0-9a-fA-F]{64}$"}}, "additionalProperties": false},
    "hierarchy": {"type": "object", "required": ["area_id", "region_id", "superregion_id", "method"], "properties": {"area_id": {"type": "string", "minLength": 1}, "region_id": {"type": "string", "minLength": 1}, "superregion_id": {"type": "string", "minLength": 1}, "method": {"type": "string", "minLength": 1}}, "additionalProperties": false},
    "extension": {"type": "string", "pattern": "^x-[a-z0-9][a-z0-9-]*:[a-z0-9][a-z0-9_.-]*$"},
    "facets": {"type": "object", "required": ["habitability", "population_presence", "settlement_pattern", "tenure", "authority"], "properties": {"habitability": {"anyOf": [{"enum": ["habitable", "marginal", "uninhabitable", "unknown"]}, {"$ref": "#/$defs/extension"}]}, "population_presence": {"anyOf": [{"enum": ["none", "transient", "seasonal", "resident", "mixed", "unknown"]}, {"$ref": "#/$defs/extension"}]}, "settlement_pattern": {"anyOf": [{"enum": ["none", "mobile", "semi_mobile", "dispersed", "nucleated", "mixed", "unknown"]}, {"$ref": "#/$defs/extension"}]}, "tenure": {"anyOf": [{"enum": ["none", "customary_community", "polity_associated", "shared", "contested", "unknown"]}, {"$ref": "#/$defs/extension"}]}, "authority": {"anyOf": [{"enum": ["none", "local_decentralized", "tributary_influence", "administered", "occupied", "shared", "contested", "unknown"]}, {"$ref": "#/$defs/extension"}]}}, "patternProperties": {"^x-[a-z0-9][a-z0-9-]*:[a-z0-9][a-z0-9_.-]*$": {"type": "string", "pattern": "^(x-[a-z0-9][a-z0-9-]*:)?[a-z0-9][a-z0-9_.-]*$"}}, "additionalProperties": false},
    "statusRelationship": {"type": "object", "required": ["relationship", "actor_political_unit_id"], "properties": {"relationship": {"anyOf": [{"enum": ["sovereign", "owner", "controller", "core", "claim", "dispute", "protector", "co-administrator", "occupier", "mandate-authority", "lessee", "claimant", "territorial_presence", "seasonal_use", "customary_tenure", "tributary_influence"]}, {"$ref": "#/$defs/extension"}]}, "actor_political_unit_id": {"type": "string", "minLength": 1}, "valid_from": {"type": "string", "format": "date"}, "valid_to": {"type": "string", "format": "date"}, "evidence_ids": {"$ref": "#/$defs/nonemptyStrings"}, "certainty": {"enum": ["documented", "disputed", "uncertain"]}}, "additionalProperties": false}
  },
  "allOf": [{"if": {"properties": {"schema_version": {"enum": ["0.1.0", "0.2.0", "0.3.0"]}}, "required": ["schema_version"]}, "then": {"properties": {"assignments": {"items": {"properties": {"polity_ids": {"minItems": 1}}}}}}}, {"if": {"properties": {"schema_version": {"enum": ["0.2.0", "0.3.0", "0.4.0"]}}, "required": ["schema_version"]}, "then": {"required": ["constraint_sha256", "release_sidecars"], "properties": {"assignments": {"items": {"required": ["region_id", "sovereign_polity_id", "owner_polity_id", "controller_polity_id", "core_polity_ids", "claim_polity_ids", "dispute_polity_ids", "hierarchy"]}}}}}, {"if": {"properties": {"schema_version": {"const": "0.4.0"}}, "required": ["schema_version"]}, "then": {"properties": {"assignments": {"items": {"required": ["facets"]}}}}}],
  "additionalProperties": false
}
